{
  "id": "daniels",
  "name": "Daniels' Running Formula (VDOT)",
  "coach": "Jack Daniels, PhD",
  "yearOfOrigin": 1998,
  "keyBook": "Daniels' Running Formula",
  "citations": [
    {
      "source": "Jack Daniels",
      "title": "Daniels' Running Formula (3rd Edition)",
      "year": 2014
    },
    {
      "source": "Jack Daniels",
      "title": "Daniels VDOT Calculator and pace tables",
      "url": "https://vdoto2.com/"
    }
  ],
  "description": "VDOT-based system that derives all training paces from a single fitness number computed from a recent race performance. Five pace zones — E, M, T, I, R — each tied to a specific physiological adaptation. Built around 2 quality (Q) sessions per week plus easy fill.",
  "signature": "VDOT-based pace zones (E/M/T/I/R) with 2 quality sessions per week",
  "philosophyNarrative": "Daniels' system rests on three pillars: (1) every training pace targets a specific physiological adaptation, not a feeling; (2) you derive every pace from a single VDOT number computed from a recent race; (3) you organize the year into four phases that progressively transition from base aerobic work to race-specific quality. The two-quality-sessions-per-week structure ('2Q') is what most amateur runners follow — one threshold/interval session and one long run with embedded quality, with everything else at conversational easy pace. The genius of the system is that as your VDOT improves, every pace updates automatically, so the structure stays the same while the work gets faster.",
  "primaryAnchor": "recent_race_time",
  "fallbackAnchor": "self_assessed_pace",
  "paceZones": [
    {
      "canonical": "recovery",
      "displayName": "Recovery",
      "abbreviation": "Rec",
      "purpose": "Active recovery between hard sessions — slower than E pace. The goal is movement and blood flow, not training stimulus. Should leave you feeling better, not more tired.",
      "paceFormula": {
        "anchorType": "vdot",
        "strategy": "offset_from_anchor",
        "expression": "easy_pace + 30 sec/mile",
        "offsetSecPerMile": { "min": 20, "max": 60 }
      },
      "rpeRange": { "min": 2, "max": 3, "description": "Very easy — effortless; could continue indefinitely without strain" },
      "hrRange": { "minPctLthr": 0.55, "maxPctLthr": 0.65 }
    },
    {
      "canonical": "easy",
      "displayName": "E pace (Easy)",
      "abbreviation": "E",
      "purpose": "Develops cardiovascular base, capillary density, and mitochondrial adaptations. Most weekly mileage is at this pace. Conversational throughout — should be able to speak in full sentences.",
      "paceFormula": {
        "anchorType": "vdot",
        "strategy": "vdot_table",
        "expression": "vdot_table.E[vdot]"
      },
      "rpeRange": { "min": 3, "max": 5, "description": "Conversational; full sentences without breath struggle" },
      "hrRange": { "minPctLthr": 0.65, "maxPctLthr": 0.79 }
    },
    {
      "canonical": "marathon_pace",
      "displayName": "M pace (Marathon)",
      "abbreviation": "M",
      "purpose": "Race pace for marathon. Used in marathon-specific workouts and embedded in long runs late in training to build pace tolerance.",
      "paceFormula": {
        "anchorType": "vdot",
        "strategy": "vdot_table",
        "expression": "vdot_table.M[vdot]"
      },
      "rpeRange": { "min": 6, "max": 7, "description": "Comfortably hard but sustainable for a long time" },
      "hrRange": { "minPctLthr": 0.80, "maxPctLthr": 0.88 }
    },
    {
      "canonical": "lactate_threshold",
      "displayName": "T pace (Threshold)",
      "abbreviation": "T",
      "purpose": "Develops lactate threshold — the ability to clear lactate as fast as it accumulates. 'Comfortably hard'; about 1-hour race pace. Done as steady tempo (20-30 min) or cruise intervals (5-15 min reps with short rest).",
      "paceFormula": {
        "anchorType": "vdot",
        "strategy": "vdot_table",
        "expression": "vdot_table.T[vdot]"
      },
      "rpeRange": { "min": 7, "max": 8, "description": "Comfortably hard; 1-hour race pace; can speak only in short phrases" },
      "hrRange": { "minPctLthr": 0.88, "maxPctLthr": 0.92 }
    },
    {
      "canonical": "vo2max",
      "displayName": "I pace (Interval)",
      "abbreviation": "I",
      "purpose": "Develops VO2max — maximum oxygen uptake. Done as 3-5 minute intervals at ~3K-5K race pace, with equal jog recovery. Total volume capped at 8% of weekly mileage or 10K, whichever is less.",
      "paceFormula": {
        "anchorType": "vdot",
        "strategy": "vdot_table",
        "expression": "vdot_table.I[vdot]"
      },
      "rpeRange": { "min": 8, "max": 9, "description": "Hard; 3K-5K race pace; cannot speak more than a word or two" },
      "hrRange": { "minPctLthr": 0.95, "maxPctLthr": 1.00 }
    },
    {
      "canonical": "speed",
      "displayName": "R pace (Repetition)",
      "abbreviation": "R",
      "purpose": "Develops running economy, speed, and neuromuscular efficiency. Faster than VO2max — done as 200-600m reps with FULL recovery (typically 2-4× rep duration). NOT a cardiovascular workout; it's a speed/economy workout.",
      "paceFormula": {
        "anchorType": "vdot",
        "strategy": "vdot_table",
        "expression": "vdot_table.R[vdot]"
      },
      "rpeRange": { "min": 9, "max": 9, "description": "Fast and crisp; not maximum sprint — quick but controlled" }
    }
  ],
  "workouts": [
    {
      "id": "daniels_easy_run",
      "name": "Easy Run (E)",
      "shortDescription": "Conversational base run at E pace",
      "category": "easy",
      "primaryZone": "easy",
      "displayName": "E Run",
      "structure": {
        "mainSet": [
          {
            "description": "Steady run at E pace",
            "duration": { "value": 45, "unit": "min" },
            "paceZone": "easy",
            "cue": "Conversational throughout. If you cannot speak in full sentences, slow down."
          }
        ]
      },
      "approxDurationMinutes": { "min": 30, "max": 75 },
      "approxDistanceMiles": { "min": 3, "max": 9 },
      "purpose": "Aerobic base development and recovery between hard sessions. Foundation of every Daniels plan — 70-80% of weekly mileage.",
      "cues": [
        "Conversational pace — should be able to speak full sentences",
        "If pace creeps up, deliberately back off",
        "Goal is repeated stress without depletion"
      ],
      "validPhaseIds": ["foundation", "early_quality", "transition_quality", "final_quality"]
    },
    {
      "id": "daniels_long_run",
      "name": "Long Run (E)",
      "shortDescription": "Long steady run at E pace, capped at ~25-30% of weekly mileage",
      "category": "long",
      "primaryZone": "easy",
      "displayName": "Long Run (E)",
      "structure": {
        "mainSet": [
          {
            "description": "Long steady run at E pace; for marathon training, build to 18-22 miles",
            "duration": { "value": 120, "unit": "min" },
            "paceZone": "easy",
            "cue": "Stay conversational the entire run. Carry water and fuel for runs >90 min."
          }
        ]
      },
      "approxDurationMinutes": { "min": 60, "max": 180 },
      "approxDistanceMiles": { "min": 8, "max": 22 },
      "purpose": "Builds endurance, cardiovascular efficiency, and fatigue resistance. Critical for half/full marathon. Capped at 25-30% of weekly mileage to prevent injury.",
      "cues": [
        "Time on feet matters more than pace",
        "Practice marathon-day fueling on runs over 90 minutes",
        "Effort should remain steady, not rising"
      ],
      "validPhaseIds": ["foundation", "early_quality", "transition_quality", "final_quality"]
    },
    {
      "id": "daniels_long_run_with_marathon_pace",
      "name": "Long Run with M-Pace Segment",
      "shortDescription": "Long run with embedded marathon-pace miles for race specificity",
      "category": "long",
      "primaryZone": "marathon_pace",
      "displayName": "Long Run + M-Pace",
      "structure": {
        "warmup": {
          "description": "Easy warmup at E pace",
          "duration": { "value": 30, "unit": "min" },
          "paceZone": "easy"
        },
        "mainSet": [
          {
            "description": "Marathon-pace segment in the middle of the run",
            "distance": { "value": 6, "unit": "mi" },
            "paceZone": "marathon_pace",
            "cue": "Lock into the rhythm you'll race at. Should feel controlled, not strained."
          },
          {
            "description": "Easy running to complete total distance",
            "duration": { "value": 45, "unit": "min" },
            "paceZone": "easy"
          }
        ]
      },
      "approxDurationMinutes": { "min": 90, "max": 180 },
      "approxDistanceMiles": { "min": 12, "max": 22 },
      "purpose": "Builds the ability to hold marathon goal pace under fatigue. Used in late-phase marathon prep (Phase III/IV).",
      "cues": [
        "M-pace should feel sustainable, not racing",
        "If M-pace feels labored, your goal time may be too aggressive",
        "Practice race-day fueling during this run"
      ],
      "validPhaseIds": ["transition_quality", "final_quality"],
      "minimumExperience": "intermediate",
      "requiresBaseMileage": 30
    },
    {
      "id": "daniels_threshold_steady",
      "name": "Steady Threshold Tempo (T)",
      "shortDescription": "20-30 minute continuous run at T pace",
      "category": "tempo",
      "primaryZone": "lactate_threshold",
      "displayName": "Tempo (T)",
      "structure": {
        "warmup": {
          "description": "Easy warmup at E pace + 4× strides",
          "duration": { "value": 15, "unit": "min" },
          "paceZone": "easy",
          "cue": "Strides: 4× ~20 sec at R effort with full recovery between"
        },
        "mainSet": [
          {
            "description": "Continuous run at T pace",